{
  "gastos": [
    {
      "data": "16/09/2025",
      "data_iso": "2025-09-16",
      "categoria": "Fixo",
      "descricao": "Parcela do financiamento do apto Montana",
      "valor": 3571.72
    },
    {
      "data": "16/10/2025",
      "data_iso": "2025-10-16",
      "categoria": "Fixo",
      "descricao": "Parcela do financiamento do apto Montana",
      "valor": 3571.72
    },
    {
      "data": "16/11/2025",
      "data_iso": "2025-11-16",
      "categoria": "Fixo",
      "descricao": "Parcela do financiamento do apto Montana",
      "valor": 3571.72
    },
    {
      "data": "16/12/2025",
      "data_iso": "2025-12-16",
      "categoria": "Fixo",
      "descricao": "Parcela do financiamento do apto Montana",
      "valor": 3571.72
    },
    {
      "data": "24/09/2025",
      "data_iso": "2025-09-24",
      "categoria": "Fixo",
      "descricao": "Parcela Financiamento do Apto itapoã",
      "valor": 687.62
    },
    {
      "data": "24/10/2025",
      "data_iso": "2025-10-24",
      "categoria": "Fixo",
      "descricao": "Parcela Financiamento do Apto itapoã",
      "valor": 687.62
    },
    {
      "data": "24/11/2025",
      "data_iso": "2025-11-24",
      "categoria": "Fixo",
      "descricao": "Parcela Financiamento do Apto itapoã",
      "valor": 687.62
    },
    {
      "data": "24/12/2025",
      "data_iso": "2025-12-24",
      "categoria": "Fixo",
      "descricao": "Parcela Financiamento do Apto itapoã",
      "valor": 687.62
    },
    {
      "data": "03/09/2025",
      "data_iso": "2025-09-03",
      "categoria": "Fixo",
      "descricao": "Youtube Premium Family",
      "valor": 53.9
    },
    {
      "data": "03/10/2025",
      "data_iso": "2025-10-03",
      "categoria": "Fixo",
      "descricao": "Youtube Premium Family",
      "valor": 53.9
    },
    {
      "data": "03/09/2025",
      "data_iso": "2025-09-03",
      "categoria": "Itens Casa",
      "descricao": "Compra Monitor Weisser",
      "valor": 200.0
    },
    {
      "data": "13/09/2025",
      "data_iso": "2025-09-13",
      "categoria": "Lazer",
      "descricao": "teste",
      "valor": 100.0
    },
    {
      "data": "2025-11-10",
      "categoria": "Fixo",
      "descricao": "Creche Arthur ",
      "valor": 1040.0
    },
    {
      "data": "10/12/2025",
      "data_iso": "2025-12-10",
      "categoria": "Fixo",
      "descricao": "Creche Arthur ",
      "valor": 1150.0
    }
  ],
  "categorias": [
    "Saúde",
    "Fixo",
    "Mercado",
    "Lazer",
    "Alimentação",
    "Veículos",
    "Itens Casa"
  ]
}